Name,Title,Description,Stock,SEO Title,SEO Description,SEO Keywords,SEO_url
SARASVATI,Сарасвати.,"На этом флуоресцентном полотне изображена богиня Сарасвати, олицетворяющая Творчество и Знания. Яркие оттенки синтетического шелка, мерцающие в ультрафиолете, создают волшебную атмосферу, которая наполняет пространство светом и жизнью. Четкие детали и динамичная композиция привносят в интерьер ощущение гармонии и вдохновения. Эта картина станет акцентом в спальне или открытом пространстве, напоминая о важности обучения и самовыражения, а её оригинальность и ручная работа придают глубокую ценность.","☀️2.3x1.5 (L) - 2 на складе за 9990
☀️110x75 (S) - 1 на складе / 1 в CrazyBong (Москва) за 3990
☀️75x50 (XS) - 1 на складе / 1 в CrazyBong (Москва) за 1990",Картина богини Сарасвати: творчество и знания в интерьере,Флуоресцентное полотно с богиней Сарасвати наполняет пространство светом и вдохновением. Откройте для себя гармонию и оригинальность.,"Сарасвати, картина, творчество, знания, флуоресцентное полотно, интерьер, вдохновение, гармония, оригинальность",sarasvati
SHRI YANTRA,Шри Янтра.,"Шри Янтра на флуоресцентном полотне — это не просто изображение, а целый мир, наполненный глубиной и символикой. Яркие неоновые оттенки и ультрафиолетовое свечение создают эффект загадочной энергии, наполняя пространство жизнью и динамикой. Каждая деталь тщательно проработана, а синтетический шелк придаёт работе лёгкость и воздушность. Эта картина способна стать акцентом в интерьере, привнося уникальную атмосферу и вдохновение, а также служит напоминанием о гармонии и внутреннем балансе. Оригинальность ручной работы добавляет ценности, делая каждое произведение поистине уникальным.",☀️1x1 (M) - 1 на складе за 4450,Шри Янтра на флуоресцентном полотне: мир символики и энергии,Откройте для себя Шри Янтра на флуоресцентном полотне — уникальное произведение с яркими оттенками и глубокой символикой.,"Шри Янтра, флуоресцентное полотно, неоновые оттенки, символика, уникальное произведение, гармония, внутренний баланс, ручная работа",shri-yantra
GANESHA,Ганеша.,"На флуоресцентном полотне Ганеша предстает в невероятном свете, словно оживший символ мудрости. Его яркие оттенки и четкие линии создают ощущение динамики, наполняя пространство энергией. Легкий синтетический шелк, играющий с ультрафиолетом, придает картине необыкновенную глубину и фактуру. Это произведение искусства не просто украсит ваш интерьер, но и станет источником вдохновения, акцентируя внимание на уникальности вашего пространства и подчеркивая авторскую идею.",,Ганеша на флуоресцентном полотне: яркость и мудрость,"Картина Ганеши в ярких оттенках и четких линиях. Откройте для себя уникальное произведение, вдохновляющее и наполняющее энергией.","Ганеша, флуоресцентное полотно, искусство, яркие оттенки, мудрость, интерьер, вдохновение, уникальность, синтетический шелк",ganesha
DURGA,Дурга.,"Картина изображает Дургу — символ силы и творчества, в ярких, насыщенных цветах, которые словно оживают под ультрафиолетом. Использование флуоресцентного полотна добавляет произведению динамики, позволяя ему меняться в зависимости от освещения. Легкий синтетический шелк создает атмосферу легкости и воздушности, а четкость деталей подчеркивает мастерство автора. Это произведение не только украсит интерьер, но и станет центром притяжения, вызывая восхищение и вдохновение. Оригинальность и ручная работа придают картине особую ценность, а её энергия наполняет пространство жизнью и креативностью.",,Картина Дурга: сила и творчество в ярких цветах,"Откройте для себя картину Дурга, наполненную энергией и яркими цветами, которая меняется в зависимости от освещения.","Дурга, картина, флуоресцентное полотно, яркие цвета, искусство, интерьер, оригинальность, ручная работа, вдохновение",durga
HANUMAN,Хануман.,"Картина с изображением Ханумана излучает тепло и дружелюбие, благодаря ярким флуоресцентным оттенкам на легком синтетическом шелке. В ультрафиолете она преобразуется, словно оживая, наполняя пространство энергией и позитивом. Четкие детали подчеркивают индивидуальность образа, создавая уникальную атмосферу. Это произведение не просто украсит интерьер, но и станет центром внимания, способным вдохновить и поднять настроение, словно напоминание о силе дружбы и единства. Оригинальная ручная работа придает картине особую ценность, делая ее по-настоящему уникальным элементом вашего пространства.","☀️2.3x1.5 (L) - 1 на складе за 9990
☀️1.5x1 (M) - 1 в CrazyBong (Москва) за 5990
☀️110x75 (S) - 1 на складе / 1 в BoogieShop (Питер) за 3990
☀️75x50 (XS) - 2 на складе за 1990",Картина Ханумана: тепло и дружелюбие в ярких оттенках,Картина с Хануманом излучает позитив и энергию. Оригинальная ручная работа станет центром внимания в вашем интерьере.,"Хануман, картина, флуоресцентные оттенки, ручная работа, интерьер, позитив, дружба, уникальность",hanuman
NRISIMHA,Нрисимха Дев.,"На флуоресцентном полотне изображён Нарисимха Дев, мощный защитник праведности, олицетворяющий смелость и преданность. Его фигура словно вырывается из глубины ночи, освещённая яркими, насыщенными цветами, что придаёт картине удивительную динамику. Легкий синтетический шелк, на котором выполнена работа, не только усиливает световые эффекты, но и создает ощущение живости. Это произведение не просто украсит пространство, но и станет источником вдохновения, напоминая о внутренней силе и стойкости. Оригинальность работы подчеркивает авторская идея и мастерство, что делает её ценным дополнением для любого интерьера.","☀️2.3x1.5 (L) - 1 на складе за 9990
☀️1.5x1 (M) - 1 в CrazyBong (Москва) за 5990
☀️110x75 (S) - 1 на складе / 1 в CrazyBong (Москва) за 3990
☀️75x50 (XS) - 2 на складе / 1 в CrazyBong (Москва) за 1990",Нарисимха Дев на флуоресцентном полотне: смелость и преданность,"Картина с Нарисимха Девом, олицетворяющим защиту и смелость. Яркие цвета и уникальный шелк создают динамику и вдохновение.","Нарисимха Дев, флуоресцентное полотно, смелость, преданность, искусство, интерьер, яркие цвета, вдохновение, мастерство",nrisimha
BUDDHA,Будда.,"На полотне изображён Будда, излучающий спокойствие и гармонию. Его образ, выполненный на флуоресцентном шелке, словно оживает под ультрафиолетом, наполняя пространство мягким светом. Яркие цвета создают контраст с глубокими линиями, подчеркивая детали и выразительность. Эта картина не просто украшение — она становится центром медитации и умиротворения в интерьере. Оригинальная ручная работа придаёт ей уникальность, а авторская идея вдохновляет на созерцание и внутреннее спокойствие.","☀️2.3x1.5 (L) - 1 на складе за 9990
☀️110x75 (S) - 1 в CrazyBong (Москва) за 3990
☀️75x50 (XS) - 1 на складе / 1 в CrazyBong (Москва) за 1990",Будда на флуоресцентном шелке: гармония и спокойствие,"Картина Будды, излучающего спокойствие, создает атмосферу медитации. Уникальная ручная работа вдохновляет на внутреннее умиротворение.","Будда, флуоресцентный шелк, гармония, спокойствие, картина, медитация, оригинальная работа, интерьер, искусство",buddha
SHIVA AND SHAKTI,Шива и Шакти.,"На полотне, наполненном флуоресцентными оттенками, встречаются Шива и Шакти — символы единства духа и материи. Яркие, насыщенные цвета словно живут своей жизнью, а их динамика придаёт картине особую энергию. Нежный синтетический шелк под ультрафиолетом раскрывает детали, создавая магическую атмосферу, которая наполняет пространство гармонией. Это произведение искусства станет акцентом в интерьере, привнося радость и вдохновение, а его ручная работа и авторский замысел придают ему уникальную ценность.","☀️1.5x1 (M) - 1 в CrazyBong (Москва) за 5990
☀️75x50 (XS) - 1 на складе / 1 в CrazyBong (Москва) за 1990",Шива и Шакти: флуоресцентное искусство единства духа и материи,"Откройте для себя магическую атмосферу картины с Шивой и Шакти, наполненной яркими цветами и гармонией. Идеальный акцент для вашего интерьера.","Шива, Шакти, флуоресцентные цвета, искусство, гармония, интерьер, ручная работа, уникальная ценность",shiva-and-shakti
THAI CHILL,Тайский Чилл.,"На полотне «Тайский чилл» яркие флуоресцентные оттенки сливаются в гармоничное целое, создавая атмосферу спокойствия и умиротворения, характерную для буддистских традиций. Легкий синтетический шелк, светящийся в ультрафиолете, наполняет пространство энергией и жизнью, превращая его в оазис ярких красок. Эта картина станет акцентом в интерьере, привнося в него уникальность и глубину, а также даря возможность отвлечься от суеты и насладиться моментом.","☀️2.3x1.5 (L) - 1 на складе за 9990
☀️110x75 (S) - 1 на складе за 3990
☀️75x50 (XS) - 3 на складе за 1990",Тайский чилл: яркие флуоресцентные оттенки в интерьере,"Картина «Тайский чилл» создает атмосферу спокойствия и умиротворения, наполняя пространство энергией и яркими цветами.","Тайский чилл, флуоресцентные оттенки, буддистские традиции, картина, интерьер, спокойствие, умиротворение, яркие цвета",thai-chill